{
  "benchmark_id": "shor_code_stabilizer_commutation",
  "generated_at": "2026-06-27T17:18:30.395009+00:00",
  "tooling_version": "0.2.0",
  "artifacts": [
    {
      "path": "artifacts/code.json",
      "sha256": "66415e2fc67eab3b94821348fc02c074f94cc15f952fd6761fbf8a0a5483af29",
      "role": "specification"
    }
  ]
}
