{
  "benchmark_id": "three_qubit_bit_flip_code_corrects_one_x",
  "generated_at": "2026-06-27T17:18:30.651470+00:00",
  "tooling_version": "0.2.0",
  "artifacts": [
    {
      "path": "artifacts/code.json",
      "sha256": "089c75dc9aca5f7dee04ff1f0c225d7f8db82ae77689fa18139d7ce2cba31d3a",
      "role": "specification"
    },
    {
      "path": "artifacts/error_model.json",
      "sha256": "635aa0a75c0754a3fc4f78609c5c0b397a27d1fdda2583bef03bdcb8087cb1e0",
      "role": "specification"
    },
    {
      "path": "artifacts/syndrome_table.json",
      "sha256": "0152cd55d83c91edffacc713a625ed661d035cd1c1da829add44665afbdda509",
      "role": "reference"
    },
    {
      "path": "artifacts/correction_table.json",
      "sha256": "4ae612e2b520f4d609551d9ad72643877c9369ca92ff891b46a53e44236623d5",
      "role": "reference"
    }
  ]
}
