{
  "benchmark_id": "resource_contract_for_small_hamiltonian_simulation",
  "generated_at": "2026-06-27T13:35:50.857440+00:00",
  "tooling_version": "0.2.0",
  "artifacts": [
    {
      "path": "artifacts/hamiltonian.json",
      "sha256": "52591d7b61d5901772df6462f92848c62ab158b935a3839cde2b760228be8d97",
      "role": "source"
    }
  ]
}
