{
  "benchmark_id": "formalize_bit_flip_code_corrects_one_x",
  "generated_at": "2026-07-25T06:14:27.377626+00:00",
  "tooling_version": "0.2.0",
  "artifacts": [
    {
      "path": "artifacts/source.txt",
      "sha256": "46d80c3a509022ded386757c0041768ea997e73c978e6f1727b6fd80c4c35751",
      "role": "source"
    },
    {
      "path": "artifacts/draft.lean",
      "sha256": "7d7758082fe2506b3ebe10c646fef9938a3881b2fba7ef2834a42c6fe562e700",
      "role": "generated"
    },
    {
      "path": "notes/semantic_rubric.md",
      "sha256": "db657ed7990ec3c96a2102da704f3a9ba753d5d307b6696ca2cea5ae0190b1bb",
      "role": "specification"
    }
  ]
}
