{
  "benchmark_id": "steane_code_stabilizer_commutation",
  "generated_at": "2026-06-27T13:35:51.361892+00:00",
  "tooling_version": "0.2.0",
  "artifacts": [
    {
      "path": "artifacts/code.json",
      "sha256": "41b00e2cf5b74c072c1fd3c8eb8cd538bd245dc492d1256122a20cb54e36610b",
      "role": "specification"
    }
  ]
}
