{
  "benchmark_id": "circuit_identity_after_layout",
  "generated_at": "2026-06-27T17:18:29.321321+00:00",
  "tooling_version": "0.2.0",
  "artifacts": [
    {
      "path": "artifacts/source.qasm",
      "sha256": "ce49d4e871f80cc36e550cadd5559c84fb63af50a0cf3bf29a297d769ce723fa",
      "role": "source"
    },
    {
      "path": "artifacts/target.qasm",
      "sha256": "6f48412efbf0f7d6a7717d63193f1929ed5ce0ba8190e28b4c9a1c6c0594434d",
      "role": "target"
    }
  ]
}
