{
  "benchmark_id": "three_qubit_phase_flip_code_corrects_one_z",
  "generated_at": "2026-06-27T17:04:43.004994+00:00",
  "tooling_version": "0.2.0",
  "artifacts": [
    {
      "path": "artifacts/code.json",
      "sha256": "d9ceb953853263aaf9863f452b2f2805de04d2697a7f28de4758b3c8e2060c7c",
      "role": "specification"
    },
    {
      "path": "artifacts/error_model.json",
      "sha256": "f8fc122929de9ca1d19be79189225477a65af584f7402bb8c98c44596ffe4d17",
      "role": "specification"
    },
    {
      "path": "artifacts/syndrome_table.json",
      "sha256": "85a3f9610d960449c3081a451d5e1a184b4b087a7d2295c1f10ca01732a09769",
      "role": "reference"
    },
    {
      "path": "artifacts/correction_table.json",
      "sha256": "40e188962bdafc71001a822cd9423530a06a56673d7c18c04b47197d834d6f77",
      "role": "reference"
    }
  ]
}
