{
  "benchmark_id": "small_fermionic_hamiltonian_is_hermitian",
  "generated_at": "2026-06-27T17:18:30.061105+00:00",
  "tooling_version": "0.2.0",
  "artifacts": [
    {
      "path": "artifacts/hamiltonian.json",
      "sha256": "66102ea2c021742709ddc66b1e2cbe92b529a74bfec6b8974a1eabbce253ad3d",
      "role": "source"
    }
  ]
}
