{
  "benchmark_id": "qft_then_inverse_qft_identity_up_to_ordering",
  "generated_at": "2026-06-27T17:18:29.099253+00:00",
  "tooling_version": "0.2.0",
  "artifacts": [
    {
      "path": "artifacts/circuit.qasm",
      "sha256": "d0f63cc2ee48b0385947548ada10d0a0e3ad83f7bbf0c81280822d67e2a9df5e",
      "role": "source"
    }
  ]
}
