{
  "benchmark_id": "phase_polynomial_equivalence_small_instance",
  "generated_at": "2026-06-27T17:18:29.541744+00:00",
  "tooling_version": "0.2.0",
  "artifacts": [
    {
      "path": "artifacts/source.qasm",
      "sha256": "6f1b1944c97ffcd8b322b52d91dca825488a3b3e6467a987907332c1b1bc9415",
      "role": "source"
    },
    {
      "path": "artifacts/target.qasm",
      "sha256": "6f1b1944c97ffcd8b322b52d91dca825488a3b3e6467a987907332c1b1bc9415",
      "role": "target"
    }
  ]
}
