{
  "benchmark_id": "rx_gate_equivalence_small_instance",
  "generated_at": "2026-06-27T17:18:29.654369+00:00",
  "tooling_version": "0.2.0",
  "artifacts": [
    {
      "path": "artifacts/source.qasm",
      "sha256": "d4c06ae111e7d4176ef437010ecd8a52bef3af65f4576121da3a1b37b7982ac0",
      "role": "source"
    },
    {
      "path": "artifacts/target.qasm",
      "sha256": "b0b1111a0363f9d90a405a33fbe23352771e64a85909ebb91758f8d82ecf6e60",
      "role": "target"
    }
  ]
}
