{
  "benchmark_id": "logical_state_preserved_up_to_pauli_frame",
  "generated_at": "2026-06-27T13:35:51.177339+00:00",
  "tooling_version": "0.2.0",
  "artifacts": [
    {
      "path": "artifacts/code.json",
      "sha256": "1725bb825ac7382b7d3d5286cdad791fecd4ef11f2dde1b52df61ed7197bcb1e",
      "role": "specification"
    }
  ]
}
