{
  "benchmark_id": "formalize_small_hamiltonian_hermiticity_statement",
  "generated_at": "2026-06-27T17:18:28.497368+00:00",
  "tooling_version": "0.2.0",
  "artifacts": [
    {
      "path": "artifacts/source.txt",
      "sha256": "c4169bc8b17d92118bbb2d023d14e309a403fb2ac40ab0d330cf9e59f69eb6f0",
      "role": "source"
    },
    {
      "path": "artifacts/draft.lean",
      "sha256": "7d7758082fe2506b3ebe10c646fef9938a3881b2fba7ef2834a42c6fe562e700",
      "role": "generated"
    },
    {
      "path": "notes/semantic_rubric.md",
      "sha256": "99b299b2d6c1848aeff9dc0446c1dec9af2649f142c7fb31b917c9182d688017",
      "role": "specification"
    }
  ]
}
