{
  "benchmark_id": "bb84_sifted_key_partial_claim",
  "generated_at": "2026-06-27T17:18:30.120960+00:00",
  "tooling_version": "0.2.0",
  "artifacts": [
    {
      "path": "artifacts/protocol.json",
      "sha256": "3c393e8d08da034ff0f6ea51bf266fb90a46b7610e92a9f307189131f4d267c5",
      "role": "specification"
    }
  ]
}
